label,text
1,عرف مصطلح الجريمة الإلكترونية 
1,عرف مصطلح أمن المعلومات
1,عرف مصطلح الهندسة الاجتماعية النفسية
1,عرف مصطلح تبييض أو غسيل الأموال 
1,عرف مصطلح الذكاء الاصطناعي
1,عرف مصطلح التحليل الاقتصادي
1,عرف مصطلح الاحتباس الحراري
1,عرف مصطلح التنمية المستدامة
1,عرف مصطلح الديمقراطية البرلمانية
1,عرف مصطلح الطاقة المتجددة
1,عرف مصطلح التنمية المستدامة
1,عرف مصطلح الذكاء الاصطناعي
1,عرف مصطلح التغير المناخي
1,عرف مصطلح الجينوم البشري
1,عرف مصطلح التعلم العميق
1,عرف مصطلح التكنولوجيا النانوية
1,عرف مصطلح العولمة الاقتصادية
1,عرف مصطلح التحرش الجنسي
1,عرف مصطلح الانحراف الاجتماعي
1,عرف مصطلح الاكتئاب النفسي
1,عرف مصطلح التمييز العنصري
1,عرف مصطلح التشوه الجيني
1,عرف مصطلح الديمقراطية البرلمانية
1,عرف مصطلح البلاستيك القابل للتحلل
1,عرف مصطلح الانترنت الأشياء (IoT)
2,ما هي الأصناف الرئيسية للبرمجيات الماكرة
2,"  ماهي أشكال المضايقات التي يمكن أن يتعرض لها مستخدم وسائل التواصل الاجتماعي(فايسبوك، ...) ؟"
2,ما نوع الجريمة الإلكترونية التي قد تكون أنت  ضحيتها عبر بريد إلكتروني يخبرك بأن شخصا يريد أن يتقاسم معك جوائز أو أموالا؟
2,ماهي الأسس التي يجب إتباعها للحد من انتشار الجريمة الإلكترونية؟
2,ما هي أهم استراتيجيات الحماية من هجمات البرمجيات الخبيثة؟
2,ما هي أنواع الاحتيال الإلكتروني التي تستهدف المعاملات المصرفية عبر الإنترنت؟
2,ما هي السياسات الأمنية الأساسية لحماية الشبكات الحاسوبية من الاختراقات؟
2,ما هي الاحتياطات الأمنية التي يجب اتخاذها لحماية البيانات الشخصية على الإنترنت؟
2,ما هي الطرق الفعالة للتعرف على ومكافحة التسلل الإلكتروني والاختراقات السيبرانية؟
2,ما هي الأساليب الشائعة لاختراق الأجهزة الذكية والتجسس عليها؟
2,ماهي الطرق الفعالة لحماية بياناتك الشخصية على الإنترنت؟
2,ما هي التدابير الأمنية الواجب اتباعها عند استخدام شبكات الواي فاي العامة؟
2,ماهي أهم النصائح للحفاظ على سلامة الأطفال على الإنترنت؟
2,ما هي العواقب القانونية للتحرش عبر الإنترنت والتنمر الإلكتروني؟
2,"ماهي أبرز التقنيات المستخدمة في هجمات الاحتيال الإلكتروني (الفيشنج، السمسرة)؟"
2,ما هي الأنشطة غير القانونية المرتبطة بالويب العميق (Deep Web) والويب المظلم (Dark Web)؟
2,ماهي أفضل الممارسات لحماية حسابات البريد الإلكتروني من الاختراق؟
2,ما هي طرق التحقق الثنائي (Two-Factor Authentication) وأهميتها في الأمان الإلكتروني؟
2,ماهي أبرز طرق الدفاع عن الهجمات الإلكترونية للشركات والمؤسسات؟
2,ما هي السياسات والتشريعات المتعلقة بالخصوصية وحماية البيانات في الدولة؟
2,ماهي الطرق الفعالة للكشف المبكر عن اختراقات الأمان في الشبكات؟
2,ما هي أهم التحديات التي تواجه الأمان السيبراني في القطاع المالي؟
2,ماهي الأخطار المحتملة لاستخدام التطبيقات والبرامج من مصادر غير موثوقة؟
2,ما هي الاحتياطات الأمنية الواجب اتباعها عند التعامل مع رسائل البريد الإلكتروني الغير معروفة؟
2,ما هي أبرز الطرق لحماية هويتك الرقمية عبر الإنترنت والحد من عمليات الاحتيال الشخصية؟
3,ماهي النتائج المترتبة عن  إصابة  النظام المعلوماتي بحصان طروادة ؟  
3,ما هي النتائج المترتبة على استعمال تقنيات القياس الحيوي في الدخول إلى النظام المعلوماتي؟
3,ما النتائج المترتبة عن تطبيق سياسة أمن المعلومات في النظام المعلوماتي ؟
3,ما النتائج المترتبة على تطبيق اختبار الاختراق من طرف الهاكر؟
3,ما النتائج المترتبة عن انقطاع التيار الكهربائي المفاجئ على النظام المعلوماتي؟
3,ما النتائج المترتبة عن تسريب معلومات حساسة من النظام المعلوماتي؟
3,ما النتائج المترتبة عن استخدام برمجيات غير مرخصة على النظام المعلوماتي؟
3,ما النتائج المترتبة عن عدم تحديث برامج الحماية الخاصة بالنظام المعلوماتي؟
3,ما النتائج المترتبة عن فشل النظام المعلوماتي في التعامل مع هجمات الاحتيال الإلكتروني؟
3,ما النتائج المترتبة عن تسريب البيانات الشخصية في النظام المعلوماتي؟
3,ماهي النتائج المترتبة عن هجوم الفيروسات على النظام المعلوماتي؟
3,ما النتائج المترتبة عن انقطاع التيار الكهربائي الطارئ على النظام المعلوماتي؟
3,ما النتائج المترتبة عن سوء استخدام موظف لامتيازات الوصول في النظام المعلوماتي؟
3,ماهي النتائج المترتبة عن استخدام برامج ضارة (مالوير) في النظام المعلوماتي؟
3,ما النتائج المترتبة عن عدم تحديث برامج الأمان في النظام المعلوماتي بانتظام؟
3,ما النتائج المترتبة عن اختراق حساب مستخدم مهم في النظام المعلوماتي؟
3,ماهي النتائج المترتبة عن فقدان بيانات هامة في النظام المعلوماتي؟
3,ما النتائج المترتبة عن استخدام كلمات مرور ضعيفة في النظام المعلوماتي؟
3,ماهي النتائج المترتبة عن انتشار إشاعات كاذبة عبر النظام المعلوماتي؟
3,ما النتائج المترتبة عن استخدام برامج التجسس في النظام المعلوماتي؟
3,ماهي النتائج المترتبة عن تعطل الخدمات الحيوية في النظام المعلوماتي؟
3,ما النتائج المترتبة عن فشل نظام النسخ الاحتياطي في النظام المعلوماتي؟
3,ماهي النتائج المترتبة عن استخدام برامج التصيد الاحتيالي (الفيشنج) في النظام المعلوماتي؟
3,ما النتائج المترتبة عن عدم وجود سياسات واضحة لحماية الخصوصية في النظام المعلوماتي؟
3,ماهي النتائج المترتبة عن تعرض النظام المعلوماتي لهجمات تنكيل الخدمة (DDoS)؟
4,علّل لماذا يشكل الإنسان الحلقة الضعيفة في سلسلة الأمن المعلوماتي؟
4,علّل تزايد فرص الإجرام الإلكتروني عبر العالم؟
4,علّل كيف يكون تطوير البرامج الضخمة تحديا صعبا في مجال الأمن المعلوماتي ؟ 
4,علّل لماذا لا تفكر المؤسسات غالبا في دعم سياسة الأمن في وقت مبكر من تصميم وتطوير النظام المعلوماتي ؟
4,علّل لماذا تُعتبر هجمات الهندسة الاجتماعية أحد أكثر أساليب الاختراق فعالية في مجال الأمن المعلوماتي؟
4,علّل كيف يمكن للبرمجيات الخبيثة أن تتفادى الكشف وتظل نشطة لفترات طويلة على أجهزة الكمبيوتر؟
4,علّل لماذا يعد الاختراق السيبراني تهديداً دولياً وتحدياً أمنياً عابراً للحدود الجغرافية؟
4,علّل تأثير تسريب البيانات الشخصية على المستخدمين والشركات من حيث الأمان والخصوصية.
4,علّل لماذا يتطلب استخدام التشفير القوي في الاتصالات الإلكترونية ونقل البيانات عبر الإنترنت للحفاظ على الأمان؟
4,علّل لماذا يعتبر التحقق الثنائي أحد الأساليب الأكثر فاعلية لتعزيز أمان الحسابات الإلكترونية؟
4,علّل تزايد حوادث التسريبات الضخمة (Data Breaches) في العصر الرقمي؟
4,علّل لماذا يُعتبر الاحتيال الإلكتروني (الفيشنج والسمسرة) أكثر فعالية من الاحتيال التقليدي؟
4,علّل أهمية تحديث برامج الحماية ونظم التشغيل بانتظام للحفاظ على أمان الأجهزة الإلكترونية؟
4,علّل كيف يسهم التكنولوجيا السحابية في تحسين أمان البيانات وتقليل المخاطر السيبرانية؟
4,علّل لماذا تعتبر الشبكات اللاسلكية (Wi-Fi) هدفا سهلا للهاكرز مقارنة بالشبكات السلكية؟
4,علّل تزايد الهجمات السيبرانية المتقدمة والمستهدفة (APT) في القطاع الحكومي والصناعي؟
4,علّل أهمية توعية المستخدمين بمخاطر الأمان السيبراني وتدابير الوقاية الأساسية؟
4,علّل لماذا يجب أن يكون التحقق من المصدر والتوقيع الرقمي ضروريا لتحميل البرامج والملفات؟
4,علّل تزايد استخدام التشفير وتقنيات التخفي لأنشطة الجرائم السيبرانية؟
4,علّل أهمية إجراء تدريبات ومحاكاة هجمات الاختراق (Penetration Testing) في الشركات والمؤسسات؟
4,علّل لماذا يعد التهديد الداخلي من الموظفين أحد التحديات الكبيرة للأمان المعلوماتي؟
4,علّل تزايد الهجمات السيبرانية المستهدفة للمؤسسات الصغيرة والمتوسطة؟
4,علّل أهمية تطوير سياسات الأمان المعلوماتي ومراجعتها بشكل دوري لمواكبة التهديدات الحديثة؟
4,علّل كيف يمكن للتجارة الإلكترونية أن تكون عرضة لعمليات احتيال واختراق الحسابات؟
4,علّل لماذا قد تتعرض الأجهزة الطرفية (الهواتف الذكية والأجهزة اللوحية) لمخاطر الأمان بشكل أكبر من الأجهزة الكمبيوترية التقليدية؟
5,ما الفرق بين عمل قراصنة القبعات البيضاء و عمل قراصنة القبعات السوداء؟
5,ما الفرق بين عمل قراصنة القبعات  الرمادية و عمل قراصنة القبعات السوداء؟
5,ما الفرق بين الدود والفيروسات؟
5,ما الفرق بين القرصنة واختبار الاختراق؟
5,ما الفرق بين الهجمات النشطة والهجمات السلبية في مجال الأمن المعلوماتي؟
5,ما الفرق بين الهجمات الداخلية والهجمات الخارجية على البنية التحتية للشبكات؟
5,ما الفرق بين تشفير البيانات في النقل وتشفير البيانات في الحفظ؟
5,ما الفرق بين الاختراق الموجه والاختراق العشوائي للأنظمة الحاسوبية؟
5,ما الفرق بين الاختراق النشط والاختراق السلبي في اختبار الاختراق؟
5,ما الفرق بين الاختراق الإلكتروني والاختراق الفيزيائي؟
5,ما الفرق بين التصيد الاحتيالي (الفيشنج) والتصيد الاحتيالي المتقدم (السمسرة)؟
5,ما الفرق بين الشبكات الخاصة الافتراضية (VPN) وبروكسي (Proxy)؟
5,ما الفرق بين البرامج الضارة (مالوير) وبرامج التجسس (Spyware)؟
5,ما الفرق بين الجرائم السيبرانية والجرائم الإلكترونية؟
5,ما الفرق بين التشفير المتقدم والتشفير الأساسي؟
5,ما الفرق بين الجريمة الإلكترونية والاحتيال الإلكتروني؟
5,ما الفرق بين النسخ الاحتياطي الكامل والنسخ الاحتياطي التزامني؟
5,ما الفرق بين الهجمات المستهدفة (APT) والهجمات العشوائية؟
5,ما الفرق بين تطبيق الاختبار الأبيض والاختبار الأسود في مجال الأمان المعلوماتي؟
5,ما الفرق بين الهجوم الموزع المنسق (DDoS) والهجوم التوجيهي (DoS)؟
5,ما الفرق بين التطبيقات المفتوحة المصدر والتطبيقات الخاصة؟
5,ما الفرق بين جدار الحماية (Firewall) وجدار التطبيقات (Application Firewall)؟
5,ما الفرق بين التوعية الأمنية والتدريب الأمني في المؤسسات؟
5,ما الفرق بين التوقيع الرقمي والشهادة الرقمية (Digital Certificate)؟
5,ما الفرق بين القرصنة الأخلاقية والقرصنة الغير أخلاقية؟
1,عرّف مصطلح التعلم الآلي
1,عرّف مصطلح الواقع الافتراضي
1,عرّف مصطلح التشفير .
1,عرّف مصطلح الروبوتيكا
1,عرّف مصطلح الاستدامة
1,عرّف مصطلح الشبكات الاجتماعية .
1,عرّف مصطلح الذكاء الاصطناعي
1,عرّف مصطلح التحليل الاحصائي
1,عرّف مصطلح التسويق الرقمي
1,عرّف مصطلح الهوية الرقمية
1,عرّف مصطلح الطباعة ثلاثية الأبعاد
1,عرّف مصطلح التجارة الإلكترونية
1,عرّف مصطلح الذكاء العاطفي .
1,عرّف مصطلح الأمان السيبراني
1,عرّف مصطلح الواقع المعزز .
1,عرّف مصطلح التصميم التجريبي
1,عرّف مصطلح التعلم عن بُعد.
1,عرّف مصطلح التحليل الضخم للبيانات.
1,عرّف مصطلح السحابة الحوسبية .
1,عرّف مصطلح السلوك التنظيمي .
1,عرّف مصطلح الواقع المختلط .
1,عرّف مصطلح البث المباشر .
1,عرّف مصطلح التعلم العميق .
1,عرّف مصطلح الاقتصاد المشترك .
1,عرّف مصطلح الطاقة النظيفة .
3,ما هي النتائج المترتبة عن زيادة درجات حرارة الأرض وتغير المناخ؟
3,ما النتائج المترتبة عن نقص المياه العذبة في المناطق الجافة؟
3,ما هي النتائج المترتبة عن زيادة انبعاثات الغازات الدفيئة؟
3,ما النتائج المترتبة عن انخفاض مستوى البحار وارتفاعها على المناطق الساحلية؟
3,ما هي النتائج المترتبة عن انقراض أنواع الحيوانات والنباتات؟
3,ما النتائج المترتبة عن تلوث الهواء وتأثيره على صحة الإنسان؟
3,ما هي النتائج المترتبة عن زيادة استخدام البلاستيك وتأثيره على البيئة؟
3,ما هي النتائج المترتبة عن تدهور التربة وانعكاسه على الزراعة؟
3,ما هي النتائج المترتبة عن استنزاف موارد المياه الجوفية؟
3,ما هي النتائج المترتبة عن زيادة مستوى البطالة في المجتمع؟
3,ما هي النتائج المترتبة عن انقطاع التيار الكهربائي لفترات طويلة؟
3,ما هي النتائج المترتبة عن انتشار الأخبار الزائفة والمعلومات الضارة عبر الإنترنت؟
3,ما هي النتائج المترتبة عن اتباع نظام غذائي غير صحي؟
3,ما هي النتائج المترتبة عن تراجع حرية التعبير وحقوق الإنسان في بعض الدول؟
3,ما هي النتائج المترتبة عن انخفاض مستوى التعليم والقدرات الفنية في المجتمع؟
3,ما هي النتائج المترتبة عن تدمير الغابات وتأثيره على التنوع البيولوجي؟
3,ما هي النتائج المترتبة عن تغيير نمط الحياة والتسبب في أمراض مزمنة؟
3,ما هي النتائج المترتبة عن زيادة الاستخدام الضار للمخدرات والمؤثرات العقلية؟
3,ما هي النتائج المترتبة عن تجاوز قدرة الكوكب على تلبية احتياجات السكان؟
3,ما هي النتائج المترتبة عن تأثير التكنولوجيا على عملية التواصل الاجتماعي؟
3,ما هي النتائج المترتبة عن استنفاد الموارد الطبيعية الغير متجددة؟
3,ما هي النتائج المترتبة عن زيادة مستويات التلوث الضوضائي في المدن؟
3,ما هي النتائج المترتبة عن انخفاض مستويات المياه الجوفية والآبار؟
3,ما هي النتائج المترتبة عن تحسين نظام النقل العام وتأثيره على الاقتصاد؟
3,ما هي النتائج المترتبة عن تأثير الاعتماد على التكنولوجيا في الحياة اليومية؟
2,ما هي أهم لغات البرمجة المستخدمة في تطوير تطبيقات الهاتف المحمول؟
2,ما هي أفضل الأدوات المستخدمة في بناء مواقع الويب الديناميكية؟
2,ما هي التقنيات الحديثة التي تُستخدم في تطوير تطبيقات الذكاء الاصطناعي؟
2,ما هي أهم الخصائص التي يجب أن تتوفر في نظام إدارة قواعد البيانات (DBMS) الجيد؟
2,ما هي أبرز أدوات تحليل البيانات المستخدمة في علوم البيانات؟
2,ما هي الخطوات الأساسية لتأمين شبكات الحاسوب من الاختراقات السيبرانية؟
2,ما هي أكثر الأنظمة التشغيلية استخدامًا في أجهزة الكمبيوتر الشخصية؟
2,ما هي أهم المميزات التي يجب أن تتوفر في لغة برمجة لتكون سهلة الاستخدام؟
2,ما هي أنواع الهجمات الشائعة التي يتعرض لها مستخدمو الإنترنت؟
2,ما هي أهم استراتيجيات الحماية من البرمجيات الخبيثة (المالوير)؟
2,ما هي الخطوات الضرورية لتطوير تطبيق محمول آمن وموثوق؟
2,ما هي أبرز الأدوات المستخدمة في اختبار الأمان والاختراق؟
2,ما هي أفضل الأساليب للتحقق من هوية المستخدمين في تطبيقات الويب؟
2,ما هي أهم التقنيات المستخدمة في تشفير البيانات وحمايتها؟
2,ما هي أساسيات تصميم واجهة المستخدم الجذابة والمستخدمة بسهولة؟
2,ما هي أنماط التصميم المستخدمة في تطبيقات الهاتف المحمول الحديثة؟
2,ما هي أهم الاعتبارات التي يجب مراعاتها في تطوير ألعاب الفيديو؟
2,ما هي أحدث التطورات في مجال التعلم الآلي والذكاء الاصطناعي؟
2,ما هي الخطوات اللازمة لحماية البيانات الشخصية على الإنترنت؟
2,ما هي أفضل الأدوات لإدارة المشاريع البرمجية وتتبع تقدمها؟
2,ما هي أنواع الشهادات الأمانية التي يمكن للمحترفين الحصول عليها في مجال الأمان السيبراني؟
2,ما هي أهم النصائح لتحسين أداء موقع الويب وتحميل صفحاته بسرعة؟
2,ما هي الاختلافات بين تقنيات تطوير تطبيقات الويب وتطبيقات الهاتف المحمول؟
2,ما هي أبرز التحديات التي تواجه مطوري تطبيقات الذكاء الاصطناعي؟
2,ما هي أفضل الممارسات في تطوير تطبيقات الواقع المعزز والواقع الافتراضي؟
4,علّل لماذا تعتبر التعليم التقليدي أقل فعالية من التعلم الإلكتروني في بعض الحالات؟
4,علّل تزايد أعداد المستخدمين لتطبيقات التواصل الاجتماعي وأثره على الاتصالات الشخصية والاجتماعية.
4,علّل كيف يمكن أن تؤدي الاعتماد الزائد على التكنولوجيا إلى فقدان بعض المهارات الحرفية التقليدية.
4,علّل لماذا ينبغي على المجتمعات الاستثمار في تطوير الطاقة المتجددة والتحول من الوقود الأحفوري.
4,علّل تأثير الضغوط الاجتماعية والثقافية على اتخاذ القرارات الشخصية للأفراد.
4,علّل لماذا قد تعاني بعض البلدان من أزمات اقتصادية وتبعاتها على الأوضاع الاجتماعية.
4,علّل أهمية توفير فرص عمل للشباب وتأثيرها على التنمية الاقتصادية.
4,علّل لماذا تعتبر التكنولوجيا النووية إما عملاقًا مزدهرًا أو شر نووي.
4,علّل تزايد حالات الاكتئاب والقلق في المجتمعات الحديثة وعواقبها الصحية والاجتماعية.
4,علّل لماذا ينبغي على الحكومات دعم برامج التثقيف الصحي وتوعية المواطنين بأهمية الصحة العامة.
4,علّل تأثير الحروب والنزاعات على حقوق الإنسان والعدالة الاجتماعية.
4,علّل لماذا تشهد بعض المدن زيادة في مستويات التلوث البيئي وضرورة اتخاذ إجراءات للحد منه.
4,علّل تأثير العولمة على اقتصاد الدول وتحدياتها وفرصها.
4,علّل أهمية الاستثمار في التعليم العالي والبحث العلمي لتحقيق التقدم الاقتصادي.
4,علّل لماذا يجب على المجتمعات الاستثمار في تحسين بنية النقل العام وتعزيز استدامته.
4,علّل تأثير التغيرات المناخية على الزراعة والأمن الغذائي والحلول المقترحة للتكيف معها.
4,علّل لماذا يجب على الحكومات دعم الفنون والثقافة وتشجيع الإبداع الفني.
4,علّل تأثير تكنولوجيا المعلومات والاتصالات على الحياة اليومية وتغير نمط التفاعل الاجتماعي.
4,علّل أهمية تشجيع التطوع والعمل الخيري ودورهما في بناء المجتمعات المزدهرة.
4,علّل لماذا ينبغي تعزيز حقوق الأطفال وتوفير بيئة آمنة ومحمية لهم.
4,علّل تأثير الهجرة واللجوء على الثقافة والاقتصاد والتنمية في البلدان المستقبلة.
4,علّل لماذا ينبغي التصدي لتفشي ظاهرة العنف المنزلي والأثر الإيجابي على المجتمعات.
4,علّل تأثير العولمة على التنوع الثقافي واللغوي وتحديات المحافظة على التراث الثقافي.
4,علّل أهمية توعية الجمهور بأهمية حماية البيئة والمشاركة الفعّالة في المبادرات البيئية.
