label,text
4,علّل تأثير التكنولوجيا الحديثة في تحسين وتطوير قطاعات الصحة والطب والرعاية الصحية.
5,ما الفرق بين الديمقراطية والشكلية السياسية؟
5,ما الفرق بين العلوم الطبيعية والعلوم الاجتماعية؟
5,ما الفرق بين الفلسفة والعلم؟
5,ما الفرق بين الثقافة الشعبية والثقافة الرسمية؟
5,ما الفرق بين الرأسمالية والاشتراكية؟
5,ما الفرق بين الطاقة المتجددة والطاقة الأحفورية؟
5,ما الفرق بين الانكماش والتضخم في الاقتصاد؟
5,ما الفرق بين التدخين النشط والتدخين السلبي؟
5,ما الفرق بين البيانات والمعلومات؟
5,ما الفرق بين الشفافية والسرية في الحكومة؟
5,ما الفرق بين الأدب الكلاسيكي والأدب الحديث؟
5,ما الفرق بين الوعي والذكاء؟
5,ما الفرق بين الاحتباس الحراري والتغير المناخي؟
5,ما الفرق بين النقد الأدبي والنقد الفني؟
5,ما الفرق بين الحرية الشخصية والحرية الاقتصادية؟
5,ما الفرق بين الحرب الباردة والحرب الساخنة؟
5,ما الفرق بين الاعتقادات والقيم؟
5,ما الفرق بين العنصر والمركب الكيميائي؟
5,ما الفرق بين العملة الورقية والعملة الرقمية؟
5,ما الفرق بين السينما والتلفزيون؟
5,ما الفرق بين البرامج المجانية والبرامج المدفوعة؟
5,ما الفرق بين العلامة التجارية والشعار؟
5,ما الفرق بين الوقت الجيولوجي والوقت التاريخي؟
5,ما الفرق بين الحكم الديمقراطي والحكم الشمولي؟
5,ما الفرق بين الصوت والضوء في العلوم الفيزيائية؟